title	text	publication_date
بعد نفيها سابقا لهذا الأمر.. تيك توك تعترف بقدرة موظفيها الصينيين على الدخول إلى معلومات المستخدمين الأميركيين	جددت رسالة من الشركة القائمة على تطبيق “تيك توك” المخاوف إزاء قدرة الصين على التجسس على المستخدمين الأميركيين للتطبيق، وأثارت انتقادات المشرعين بالولايات المتحدة من جديد للتطبيق الصيني.	2/7/2022
اختفت ثم عادت بتقنية جديدة.. التصوير الفوري لكل صورة سحر خاص	اختفت كاميرات بولارويد وتقنية التصوير الفوري، واستبدلت بالكاميرات الرقمية الاحترافية منها أو كاميرات الهواتف الذكية، لكن كان هناك سحر في هذه التقنية ذلك الزمان سنتعرف عليه بالتقرير التالي.	2/7/2022
لمنافسة آيفون.. شاهد ما الفكرة من الإضاءات الخلفية في هاتف “نوثنغ 1” الجديد؟	منذ إطلاقها في أواخر عام 2020، قادت الشركة الناشئة الغامضة “نوثنغ” حملة تسويقية مثيرة للانتباه، والآن أعلنت عن هاتفها الأول “نوثنغ 1”.	1/7/2022
“مزارع آلي فدائي”.. روبوت ابتكره طفلان في غزة لحماية المزارعين من مخاطر الاحتلال	شغلت بال شقيقين من غزة معاناة المزارعين، خاصة أولئك الذين تقع أراضيهم على مقربة من السياج الأمني الإسرائيلي شرق قطاع غزة، واهتديا إلى ابتكار “روبوت” زراعي يمكن وصفه بأنه “مزارع آلي فدائي”.	1/7/2022
تفوقوا على قراصنة البحر.. “الهاكرز” يستغلون التكنولوجيا للتحكم في سفن الشحن	تتعرض سفن الشحن لخطر قراصنة البحار الذين يحاولون الاستيلاء عليها وتغيير مسارها، ولكن الآن وفي عصر التكنولوجيا يتم التحكم في هذه السفن من الأرض عبر قراصنة الإنترنت.	30/6/2022
ماذا تعرف عن تقنية "إي سيم"؟	لم يعد اهتمام شركات الاتصالات الجوالة يقتصر على العملاء المتعاقدين معها فحسب، بل تعداه كذلك إلى عملاء الخدمات المدفوعة مسبقا، الذين يحتاجون إلى أجهزة جوالة تدعم تقنية “إي سيم” (eSIM)، فما هذه التقنية؟	30/6/2022
غوغل تحذر مستخدمي أندرويد من فيروس "هيرمت"	قد يتعرض المليارات من مستخدمي “أندرويد” لخطر هجوم جديد يحمل اسم “هيرمت”، يستهدفهم عبر التطبيقات المزيفة التي لديها القدرة على التحكم الكامل في الهاتف وسرقة الصور.	29/6/2022
لماذا يرغب العاملون بمجال الأمن السيبراني في الاستقالة من وظائفهم؟	يعد الأمن السيبراني أحد أهم التحديات التي تواجه البشرية؛ ولنفهم خطورة هذا التحدي، يكفي أن نعلم أن الجرائم الإلكترونية بشتى أنواعها قد كلفت الاقتصاد العالمي أكثر من 6 تريليونات دولار العام الماضي فقط.	29/6/2022
أهلا بالتغريدات الطويلة.. تويتر تطور ميزة جديدة ينتظرها الملايين	أعلن القائمون على تطبيق “تويتر” (Twitter) بدء اختبار ميزة جديدة انتظرها مستخدمو التطبيق لسنوات، وترى شركة تويتر أن الميزة الجديدة ستشكل تغييرا جذريا في سياستها.	28/6/2022
مركز إقليمي لمواهب الشركة.. "مايكروسوفت" تفتتح مكتبا نموذجيا هجينا في قطر	أصبحت مكاتب العمل الهجينة من المتطلبات المهمة في عالم الأعمال بعد الجائحة، وتتسابق الشركات لتقديم أفضل ما لديها في هذا المجال، ومنها “مايكروسوفت” التي افتتحت أخيرا أحدث مكاتبها في منطقة الشرق الأوسط.	28/6/2022
مسح الوجوه بالفيديو.. إنستغرام يختبر تكنولوجيا جديدة لمعرفة أعمار المستخدمين الحقيقية	يختبر تطبيق إنستغرام طرقًا جديدة للتحقق من أعمار المستخدمين، بما في ذلك مسح وجوههم، بعد أن تعرض للعديد من الانتقادات من الآباء والنقاد الذين يقولون إن الشركة تعرض القاصرين لمحتوى ضار.	27/6/2022
استثنوا برنامجا روسيا شهيرا.. الخبراء الألمان ينصحون بهذه البرامج لحفظ كلمات السر	عادة ما يعاني المستخدم  عند اختيار كلمة مرور مناسبة، فإذا اختار كلمة مرور سهلة، فإنه يسهل اختراقها، وإذا حدد كلمة مرور آمنة، فإنه يصعب تذكرها، وهنا تظهر أهمية برنامج مدير كلمات المرور.	26/6/2022
“التوأم الرقمي”.. محاولات الإنسان لاستنساخ نفسه رقميا هل تنجح؟	يحدث كثيرا في الحياة أن يخبرك صديق ما أنه شاهد شخصا يشبهك تماما وكأنه نسخة منك، لكن تخيل لو كان بإمكانك إنشاء توأمك الخاص، نسخة طبق الأصل من نفسك، ولكنه توأم رقمي بحت هذه المرة؟	26/6/2022
طلقات إلكترونية قبل انطلاق الحرب.. تفاصيل جديدة لهجوم قراصنة روس على المنشآت الأوكرانية	عرضت مايكروسوفت تفاصيل التهديدات الإلكترونية الروسية لأوكرانيا في تقرير حديث لها، وشبهت هجمات روسيا الإلكترونية على المؤسسات الأوكرانية قبيل اندلاع الحرب بالرصاصة التي قتلت الأرشيدوق فرانز فرديناند.	25/6/2022
منها مصر وغانا والهند.. موقع “إيرث. إف إم” يجمع أصوات الطبيعة من دول العالم	تعدّ الأصوات الطبيعية من العوامل المهدئة للعديد من الأشخاص، وهناك أصوات غريبة ولا يمكن إيجادها إلا في أماكنها الطبيعية، لهذا قرر موقع “إيرث. إف إم” جمع هذه الأصوات الطبيعية وبثها عبر الموقع.	25/6/2022
منها إغلاق التطبيقات.. 3 أخطاء فادحة يرتكبها مستخدمو آيفون وتتسبب بأعطال وخسائر	يرتكب معظم مستخدمي آيفون أخطاء يظنون أنها ليست بالأمر المهم، ولكن في الحقيقة هذه الأخطاء قد تتسبب في خسارتهم أجهزتهم وأموالهم.	24/6/2022
شاهد.. مقتل شخصين بحادث تحطم سيارة "نيو" الكهربائية التجريبية	تعاني تكنولوجيا السيارات ذاتية القيادة من حوادث تحطم السيارات خلال اختبارها في بيئة حقيقية، هذه الكوابيس لاحقت شركات كبيرة مثل غوغل وتسلا وأخيرا “نيو” الصينية التي فقدت اثنين من فريق اختبارها.	24/6/2022
بواسطة محفظة رقمية.. زوكربيرغ يخطط لإدخال الميتافيرس في حياة المستخدمين	أعلن مارك زوكربيرغ أن خدمة “فيسبوك باي” أصبحت رسميا “ميتا باي”، وركز في منشور له بشكل أساسي على ما تأمل الشركة بناءه في المستقبل،  وهو “محفظة ميتا باي” الرقمية، فما هذه المحفظة؟	23/6/2022
في حال انتشارها.. كيف تتعامل مع الصور والمعلومات المسيئة عنك على الويب؟	ينزعج المستخدم كثيرا عندما تظهر على الإنترنت معلومات خاطئة عنه أو صور له غير مرغوبة أو مهينة. ويتساءل عن كيفية التصرف السليم في مثل هذه المواقف، وعن الخيارات المتاحة لحذف المنشورات المسيئة من الويب.	23/6/2022
تحويل المهترئ إلى جديد.. هكذا تسعى تويوتا لحل مشكلة ضعف إنتاج بطاريات السيارات الكهربائية	صنع بطاريات السيارات الكهربائية مكلف جدا، وتكافح بعض الشركات للقيام بذلك على نطاق واسع، وهذا يعيق قدرتها على صنع المركبات الكهربائية، ولكن يبدو أن تويوتا وجدت الحل.	22/6/2022
فخ الذكاء الاصطناعي الذي يواجه الإنسانية هل يملك نفسا كالبشر؟	طرح جدل أثاره تصريح باحث في شركة غوغل مؤخرا، بأن النموذج اللغوي المصمم للتحدث مع الناس “لامادا” كان واعيا، العديد من التساؤلات حول إمكانية حصول الروبوتات على “المشاعر الإنسانية”.	22/6/2022
السيارات الكهربائية مثال.. التكنولوجيا الصديقة للبيئة لا تخلو من السلبيات	أعلنت وكالة الطاقة الدولية أننا سنحتاج التكنولوجيا الخضراء بشكل كبير إذا أردنا خفض الاحتباس الحراري، ولكن ما الثمن الذي يمكن للبشرية دفعه في المقابل؟	21/6/2022
بالفيديو- فولفو تختبر شاحناتها التي تعمل بخلايا الوقود الهيدروجيني	ازدادت المنافسة لتطوير تقنيات جديدة في قطاع النقل بالشاحنات في السنوات الأخيرة. وتعد فولفو من الأوائل التي تعمل على تطوير هذه التقنية بدمج الكهرباء والهيدروجين في شاحناتها التي بدأت تظهر للعلن.	21/6/2022
بعد تنزيله من قبل ملايين المستخدمين.. غوغل تحظر تطبيقا من متجرها وتطلب حذفه فورا	طلبت غوغل من جميع المستخدمين حذف تطبيق تم تنزيله أكثر من مليون مرة، بعد أن وجدت أنه يحتوي على برامج ضارة سيئة قادرة تماما على سرقة بيانات اعتماد “فيسبوك” بما في ذلك أسماء المستخدمين وكلمات المرور.	20/6/2022
تحقق من أمن حساباتك على غوغل وفيسبوك.. 24 مليار اسم مستخدم وكلمة مرور تسربت إلى الويب المظلم	نشرت شركة “ديجيتال شوز” الرائدة في مجال المخاطر الرقمية دراسة جديدة تحدد حجم اختراق كلمات المرور عالميا، وأوضحت أن هناك أكثر من 24 مليار اسم مستخدم ومجموعات كلمات مرور متداولة في أسواق مجرمي الإنترنت.	20/6/2022
الأردن.. غلاء البنزين يدفع المواطنين لاقتناء السيارات الكهربائية	أدى ارتفاع سعر البنزين في الأردن إلى لجوء المواطنين لاقتناء السيارات الكهربائية كبديل موفر، وأصبحت فاتورة التنقلات أقل كثيرا من تلك التي كانت تدفع شهريا ثمنا للبنزين.	19/6/2022
لتنظيم فوضى المكالمات الجماعية.. واتساب يتيح كتم أصوات المستخدمين الفرديين في أثناء المكالمات الجماعية	عرض واتساب العديد من الميزات الجديدة في الأسبوع الماضي، بما في ذلك القدرة على كتم صوت الأشخاص في أثناء المكالمات الجماعية والتي تعد مهمة لتنظيم هذا النوع من الاجتماعات.	19/6/2022
تهدد وجود فيسبوك وتويتر وإنستغرام.. 5 منصات ميتافيرس قادمة بقوة	تُضخ عشرات مليارات الدولارات من الاستثمارات في بيئة الميتافيرس الافتراضية من قبل كبرى شركات ودول العالم، فالكل يريد أن يكون جزءا من هذا المستقبل، ولكن ما أشهر منصات الميتافيرس الحالية؟	19/6/2022
الفيزياء والذكاء الاصطناعي.. كيف يساعد كل منهما الآخر؟	حقق العلماء لسنوات، إنجازات واختراقات كبيرة في مجال الفيزياء باستخدام عقولهم كأدوات أساسية، ولكن ماذا لو استطاع الذكاء الاصطناعي المساعدة في هذه الاكتشافات؟	18/6/2022
بالفيديو.. حاسوب فرونتير الأميركي يتصدر قائمة الحاسبات الفائقة القوة في العالم	أصبح حاسوب فرونتير الأميركي الخارق أسرع حاسوب إلكتروني في العالم، ويحتاج العلماء إلى مثل هذه الأجهزة لمحاكاة المناخ بدقة فائقة وحل ألغاز البنية الأساسية للكون.	18/6/2022
هل هناك من يسرق “الواي فاي” منك؟.. بهذه الطريقة تكتشف ذلك	يشكو العديد من المستخدمين من تغيّر في أداء شبكة الواي فاي، ويشكّون في أن أحدا ربما يسرق شبكتهم، في هذا التقرير نلخص لك الطرق التي تمكّنك من اكتشاف هذه السرقة ومنعها.	17/6/2022
تطالب بتعويض قيمته 258 مليار دولار.. دعوى قضائية ضد إيلون ماسك بسبب العملات المشفرة	رفع أحد المستثمرين دعوى تطالب إيلون ماسك بتعويض 258 مليار دولار بتهمة التلاعب بعملة مشفرة واستغلال شركتي تسلا وسبيس إكس في التسويق لعملية احتيالية تُعرف باسم المخطط الهرمي لدعم العملة المشفرة.	17/6/2022
ما أفضل الطرق لتأمين بياناتك المهمة؟ خبير ألماني يجيب	يتمتع تأمين البيانات بأهمية كبرى، حيث إنه يحمي البيانات الشخصية الحساسة -كمستندات العمل المهمة والصور العائلية- من الفقدان. ونستعرض في هذا التقرير أفضل الطرق لتآمين بياناتك، بحسب الخبراء.	16/6/2022
بالفيديو.. روسيا تستعين بروبوت “أوران-6” لتطهير مدينة ماريوبول الأوكرانية من الألغام	تستخدم روسيا الروبوتات في أعمالها الحربية في أوكرانيا، ومن ضمنها روبوت كاسح الألغام “أوران-6″، ولكن السؤال هل تقوم هذه الروبوتات بعملها بشكل فعال؟	16/6/2022
صندوق “أميركانز فرونتير فاند”.. من وراءه؟ وكيف سيطور صناعة الرقائق الأميركية؟	أنشأت مجموعة من المليارديرات بأميركا صندوقا لتمويل التكنولوجيا العميقة، وحسب تقارير صحفية فإن الصندوق يهدف إلى تعزيز المصلحة الوطنية، فمن هؤلاء المليارديرات؟ وما قصة هذا الصندوق؟	15/6/2022
دول كبرى وشركات عملاقة تراهن على الميتافيرس.. تعرف عليها	الميتافيرس بيئة افتراضية غامرة، حيث يمكنك الوجود بالفعل مع الناس في البيئة الرقمية والمجتمع الرقمي، لكن ما أكثر الدول والشركات على مستوى العالم استثمارا في الميتافيرس؟	15/6/2022
من فيسبوك إلى لينكد إن.. 10 طرق للتحكم في هاتفك الذكي	هل أنت المتحكم في هاتفك أم هو الذي يتحكم فيك؟ قد يصعب في بعض الأحيان معرفة ذلك. وفي المقال التالي نستعرض قائمة بأهم الطرق التي يمكن اتباعها للتحكم في هاتفك الذكي.	14/6/2022
لصالح العمال أم ضدهم؟.. قانون في كوريا الجنوبية يشجع المصانع على استبدال العمال بالروبوتات	بسبب لائحة جديدة تنص على أن إدارة المصنع يمكن أن تذهب إلى السجن بسبب إصابة عامل، قامت المصانع في كوريا الجنوبية بتسريع عمليات إحلال الروبوتات محل العمال.	14/6/2022
هل تسبق تكنولوجيا المستقبل تفكير المستخدمين؟	رغم الوعود والآمال التي عقدت على تنبؤات خبراء التقنية بأن الأجهزة التي نستخدمها ستكون مساحة جديدة لتعميق التكنولوجيا في حياتنا، فإن التنبؤات اصطدمت بحاجز بطء استخدامنا للتكنولوجيا المستقبلية.	13/6/2022
كذب أم كشف سر غوغل؟.. تسريح مهندس تطوير الروبوت “لامدا”	غضبت غوغل من تصريحات مهندس مسؤول عن تطوير نظام ذكاء اصطناعي عندما ادعى أن النظام الذي يطوره وصل مرحلة “الوعي”، فهل الغضب مرده عدم حقيقة الادعاء أم لكشفه سر غوغل الكبير؟	13/6/2022
لماذا لا نستخدم الميزات الرائعة في هواتفنا ولماذا تصر الشركات على إضافتها؟	تقدم الشركات، خيارات جديدة لجعل أجهزتها تبدو رائعة ومُحسّنة ولكن لن تستخدم الغالبية العظمى من الناس هذه الميزات، فبحسب خبراء التكنولوجيا فإن نسبة صغيرة من الأشخاص يستخدمون هذه الميزات ولكن لماذا؟	12/6/2022
الرعب يدب في وادي السيليكون.. هل دخل عمالقة التكنولوجيا مرحلة الركود؟	كان لمرض فيروس كورونا (كوفيد-19) تأثير يشبه السحر على نمو أرباح شركات التكنولوجيا في العالم، إذ أدرك البشر -ربما لأول مرة- أهمية هذه الشركات والخدمات التي تقدمها، ولكن بعد الجائحة يبدو أن الوضع اختلف.	12/6/2022
تعرف على أبرز ميزات وتكاليف "تليغرام بريميوم" الجديد	يبدو أن الوقت حان ليقوم تطبيق تليغرام بجني المال من المستخدمين الذين يطالبون بمميزات أكبر، ولكن ما المميزات الجديدة التي تستحق الدفع؟ وكم سيكون مبلغ الاشتراك؟ وهل ستختفي النسخة المجانية؟	11/6/2022
بعد اجتماعه بالكونغرس.. رئيس آبل يطالب بتوقيع أعلى الغرامات على الشركات التي تنتهك خصوصية المستخدمين	قال تيم كوك الرئيس التنفيذي لشركة “آبل”، في رسالة إلى الكونغرس، إنه يجب على المشرعين تطوير تشريعات الخصوصية التي تجري مناقشتها حاليًا، لإطلاقها “في أقرب وقت ممكن”.	11/6/2022
بعد تنحي شيريل ساندبيرغ.. من هو الرجل الثاني في ميتا بعد زوكربيرغ؟	لأكثر من عقد من الزمن، كان كل من مارك زوكربيرغ وشيريل ساندبيرغ يبدآن وينهيان كل أسبوع باجتماع، لكن ساندبيرغ أحدثت تغييرًا في صلب شركة التكنولوجيا العملاقة عندما أعلنت اعتزامها الخروج من شركة “ميتا”.	10/6/2022
لطردك من واتساب.. تعرف على آخر حيل المجرمين باستخدام الهندسة الاجتماعية	يواجه مستخدمو تطبيق “واتساب” عملية احتيال خطيرة تستخدم فيها تقنيات الهندسة الاجتماعية لحظر المستخدم من حسابه بعد الرد على مكالمة هاتفية واحدة.	10/6/2022
هل التكنولوجيا في خدمة الديمقراطية أم أداة من أدوات الاستبداد؟	تتيح التقنيات الحديثة وسائل جديدة للتمكين، ومع ذلك ما تزال الديمقراطية تراوح مكانها. فما الأمر؟ ولماذا لم تحقق التكنولوجيا مزيدا من الديمقراطية في العالم؟	9/6/2022
"تراكر ديتيكت".. آبل تحمي مستخدمي أندرويد من تعقبهم بمنتجاتها دون علمهم	تعتبر شبكة تحديد الموقع “وير إز” من آبل من المنتجات الجيدة لتعقب الأشياء عن طريق الهاتف الذكي آيفون، إلا أن البعض يسئ استخدامها، وأوجدت الشركة حلا لهذه المشكلة التي تعترض خصوصا مستخدمي “أندرويد”.	9/6/2022
ما التقنيات والأجهزة والإعدادات اللازمة لتصوير أفلام قصيرة رائعة؟	عند الرغبة في دخول عالم صناعة الأفلام القصيرة تظهر متطلبات مختلفة تماما للتقنيات المستخدمة مع تسجيل مقاطع الفيديو اليومية، ولكن يمكن لتقنيات بسيطة وغير مكلفة أن توصلك لهذا المستوى.	8/6/2022
التكنولوجيا تدخل الحرب الروسية الأوكرانية بقوة ولكن من ينتصر؟	على مر التاريخ، كان للتقنيات الجديدة المستخدمة في المعارك والحروب دور محوري في حسم النتائج على أرض الميدان، ولكن كيف أصبح دورها في عصرنا خصوصا الحرب الأخيرة بين روسيا وأوكرانيا؟	8/6/2022
للمصور المبتدئ أو المحترف.. أسرار استعمال الوضع الاحترافي في كاميرات الهواتف الذكية	يولي المصورون المحترفون أهمية كبيرة للوضع الليلي في كاميرات الهواتف الذكية عند التصوير في الظلام أو فترة الشفق، ولكن هناك وضع آخر يحتاجه المصور المبتدئ ليتمكن من أخذ اللقطات وهو الوضع الاحترافي.	7/6/2022
أعلنت عنه آبل في مؤتمرها.. ماك بوك آير الجديد بتصميم مختلف وأداء عال	كشفت آبل في مؤتمرها للمطورين 2022 عن أحدث نسخة من جهاز الحاسوب المحمول من نوع ماك بوك آير الذي يستخدم أفضل تكنولوجيا الشرائح المصنعة في الشركة، فما ميزات هذا الجهاز؟	7/6/2022
حاسوب ماك إير جديد وأنظمة وتطبيقات مميزة.. هذا أبرز ما أعلن عنه في مؤتمر آبل للمطورين	كشفت آبل في مؤتمرها السنوي للمطورين 2022 عن أحدث إنتاجاتها من الأجهزة والتطبيقات وتحديثات أنظمة التشغيل، وهذا أبرز ما أعلنت عنه.	6/6/2022
يستهدف مستخدمي هواتف أندرويد.. تحذير من حيلة جديدة لسرقة الأموال	يستهدف تهديد جديد جيوب أصحاب الهواتف الذكية التي تعمل بنظام أندرويد بفاتورة لم يتوقعوها أبدا، حسب تقرير حديث لموقع إكسبريس.	6/6/2022
بعد تهديد العاملين بالطرد إذا لم يعودوا للمكاتب.. تسريب رسالة لماسك يعلن فيها الاستغناء عن الموظفين	يبدو أن الأمور لا تسير بشكل جيد مع أغنى رجل في العالم؛ فبعد العراقيل في صفقة شراء تويتر، هدد إيلون ماسك الموظفين الذين لن يلتزموا بالعمل من المكاتب بالطرد، والآن سربت رسالة يدعو فيها لتقليص العمالة.	6/6/2022
