title	text	publication_date
منافس "شات جي بي تي" الصيني يتخطى 100 مليون مستخدم بشهرين	أعلنت شركة التكنولوجيا الصينية “بايدو” أن عدد مستخدمي أداتها للذكاء الاصطناعي التوليدي “إيرني بوت” تجاوز حاجز المئة مليون مستخدم في غضون شهرين فقط من إطلاقه.	29/12/2023
من هو أفيناتان أور مهندس شركة "إنفيديا" الذي أسرته حماس؟	وقع أفيناتان أور الذي يعمل في شركة إنفيديا الأميركية في قبضة حركة المقاومة الإسلامية “حماس” منذ بداية عملية طوفان الأقصى، فمن هو “أور” وما هو مشروع الحاسوب العملاق الذي تطوره إنفيديا في إسرائيل؟	29/12/2023
خاتم ذكي يقيس ضغط الدم من "كوسبيتفيت"	أطلقت شركة “كوسبيتفيت” خاتمها الذكي “آي هيل رينغ” الجديد الذي يقدم العديد من الوظائف الصحية، مثل قياس ضغط الدم وقياس معدل ضربات القلب وتشبع الدم بالأكسجين.	28/12/2023
نيويورك تايمز تقاضي شركات الذكاء الاصطناعي لانتهاكها حقوق الملكية	رفعت صحيفة نيويورك تايمز دعوى قضائية فدرالية على شركتي “مايكروسوفت” و”أوبن إيه آي” في محاولة لإنهاء استخدامهما قصصها لتدريب روبوتات الدردشة دون إذنها.	28/12/2023
آبل تستأنف بيع الجيل التاسع من ساعاتها بقرار من المحكمة	ستتمكن شركة آبل من بيع أحدث ساعاتها بعد إيقاف أمر حظر البيع مؤقتا من قبل محكمة الاستئناف أمس الأربعاء، والذي يعد انتصارا كبيرا للشركة الأميركية.	28/12/2023
"إنتروبي".. ذكاء اصطناعي يكشف حقائب الماركات المزيفة	هل تساءلت عما إذا كانت حقيبة شانيل التي اشتريتها من بائع قديم أصلية؟ ربما يمكنك الآن معرفة ذلك على وجه اليقين بفضل الذكاء الاصطناعي.	27/12/2023
إسرائيل تمنح إنتل 3.2 مليارات دولار لإنشاء مصنع شرائح بها	اتفقت الحكومة الإسرائيلية على منح شركة إنتل منحة بقيمة 3.2 مليارات دولار لإنشاء مصنع جديد للرقائق بقيمة 25 مليار دولار تخطط لبنائه في جنوب إسرائيل.	27/12/2023
شاهد.. هاتف "أوكيتيل" موافق للمعايير العسكرية الأميركية	اطلقت شركة أوكيتيل هاتفها الجديد دبليو 33 برو الذي يتميز بهيكل متين للغاية وبطارية ضخمة تمكّن المستخدم من شحن الأجهزة الإلكترونية الأخرى.	27/12/2023
احذر.. رسائل قرصنة تستهدف مستخدمي آبل	يقوم القراصنة بشكل كبير في هذه الأيام باستهداف مستخدمي آبل برسائل تصيّد احتيالي مغرية، وقد حذرت بوابة حماية المستهلك الألمانية “واتش لست إنترنت” من رسالة خاصة بدأت تنتشر في أوساط المستخدمين.	26/12/2023
برنامج القرصنة "الحرباء".. العدو المستتر في أجهزة أندرويد	يعطل البرنامج الضار المعروف باسم شاميلون أو “الحرباء” في أجهزة أندرويد ميزة فتح القفل ببصمة الإصبع أو الوجه واستخدام رقم التعريف الشخصي المسروق الخاص بك.	25/12/2023
"إنفيديا" الأميركية تتبرع بأكبر مبلغ في تاريخها لإسرائيل	تتواصل الحرب على غزة في استقطاب شركات التكنولوجيا لإظهار دعمها الصريح لإسرائيل، فهذه أحد أكبر شركات تصنيع الرقائق الإلكترونية “إنفيديا” تعلن عن تبرعها بأكبر حملة في تاريخها لجمع التبرعات الإنسانية.	25/12/2023
ميتا ترفض إلغاء خاصية تساعد المتحرشين في استهداف الأطفال	رفض المسؤولون التنفيذيون في ميتا تعطيل ميزة التوصية “بيبول يو ماي نو” ضمن فيسبوك بعد أن اقترح أحد الموظفين أنها قد تؤدي إلى استغلال الأطفال.	25/12/2023
الذكاء الاصطناعي.. أبهى صور التفاعل بين البشر والتكنولوجيا	يشهد عالمنا تحولات هائلة في مجال الذكاء الاصطناعي، ويعكس هذا التطور السريع تحولا ثوريا في كيفية تفاعلنا مع التكنولوجيا، وكيف تلعب التقنية الناشئة دورا حيويا في شتى جوانب حياتنا.	24/12/2023
غوغل تعيد إطلاق تطبيق الدردشة "تشات" بشكل جديد	أطلقت غوغل الإصدار الجديد المعاد تصميمه من تطبيقها للمراسلة الفورية “غوغل تشات” لمستخدمي نظام أندرويد، وشمل الإصدار الجديد إضافة عدة تبويبات للصفحة الرئيسية والرسائل المباشرة في شريط جديد عائم.	22/12/2023
مايكروسوفت تتيح إنشاء أغان وموسيقى باستخدام الذكاء الاصطناعي	أعلنت شركة مايكروسوفت أنها أتاحت لمستخدميها إمكانية إنشاء الموسيقى وتأليف الأغاني اعتمادا على الذكاء الاصطناعي بفضل إدماج أداة سونو في مساعدها الذكي كوبايلوت (Copilot) الذي زودت به متصفحها “إيدج”.	22/12/2023
منصة إكس تعود للعمل بعد انقطاع مفاجئ لم يعرف سببه	عادت منصة التواصل الاجتماعي “إكس” (تويتر سابقا) بعد انقطاع الخدمة عن مستخدمين حول العالم في وقت مبكر من صباح اليوم الخميس، إذ واجه أكثر من 77 ألف مستخدم في الولايات المتحدة مشكلات في ذروة الانقطاع.	21/12/2023
هيومن رايتس ووتش: ميتا تخنق الأصوات المؤيدة لفلسطين على إنستغرام وفيسبوك	قالت منظمة هيومن رايتس ووتش إن سياسات شركة “ميتا” أسكتت بشكل متزايد الأصوات المؤيدة لفلسطين على منصتي إنستغرام وفيسبوك في ظل الحرب الإسرائيلية على غزة.	21/12/2023
آبل تطور المزايا الصحية لساعتها وتوقف مبيعات نماذج منها	تعمل شركة آبل على تطوير مزايا جديدة مرتبطة بالصحة لساعتها الذكية استعدادا لتوفيرها مع الإصدارات القادمة في عام 2024 المقبل.	20/12/2023
"شات جي بي تي" يرسب في اختبار الثقة	على الرغم من أن “شات جي بي تي” يقوم بعمل مثير للإعجاب في الإجابة بشكل صحيح على الأسئلة المعقدة، فإن دراسة جديدة تشير إلى أنه قد يكون من السهل للغاية إقناعه بأنه مخطئ.	17/12/2023
روبوتات صغيرة من خلايا بشرية لعلاج الأنسجة التالفة	ابتكر باحثون روبوتات بيولوجية صغيرة أطلقوا عليها اسم “أنثروروبوتس” من خلايا القصبة الهوائية البشرية، وقد وجدوا أنها تشجع نمو الخلايا العصبية في منطقة متضررة في أطباق التجارب المعملية.	14/12/2023
نموذج جِمني.. تحد لـ"شات جي بي تي" أم مصدر إحراج لـ"غوغل"؟	أفرجت شركة غوغل عن نموذجها الجديد في الذكاء الاصطناعي التوليدي المسمى جِمني، وكالعادة رافق طرح غوغل الجديد لعائلة جمني العديد من الشكوك والتساؤلات.	13/12/2023
"مصنع إعدامات جماعية".. الذكاء الاصطناعي في خدمة الجيش الإسرائيلي	في السنوات الأخيرة اتجهت إسرائيل لدعم ترسانتها العسكرية بأنظمة الذكاء الاصطناعي والخوارزميات الدقيقة والمتطورة، والتي قامت باستخدامها في حربها التي وصفت بأنها الأكثر وحشية على قطاع غزة.	11/12/2023
الروبوت في زمن التكنولوجيا الذهبي.. تطور مطّرد يأخذ بالألباب	أدت التطورات المتتالية التي شهدها مجال صناعة الروبوتات في السنوات الأخيرة إلى تغييرات كبيرة في حياتنا، وأصبحت الروبوتات جزءا لا يتجزأ من حياتنا المهنية والشخصية.	11/12/2023
التقنية البيومترية وتطبيقاتها في أمان البيانات والتحقق الشخصي	تشير القياسات الحيوية إلى قياس الخصائص الفريدة للجسم والسلوك البشري مثل بصمات الأصابع وأنماط الصوت وقياسات اليد، وتعد تقدما في علوم الحاسوب وأمن المعلومات، فكيف بدأت وما هو مستقبل هذه التكنولوجيا؟	10/12/2023
ساعة آبل ووتش 9.. ما الذي تغير فيها؟	رغم قيام شركة آبل بإجراء تحسينات على ساعاتها الذكية بصورة منتظمة، فإن التحسينات التي أجرتها على الموديلات التي طُرحت الخريف الماضي كانت أقل من المتوقع.	10/12/2023
شركات ألعاب الفيديو تخفض عمالتها رغم الإيرادت المرتفعة	يقول الخبراء إن صناعة ألعاب الفيديو صححت مسارها على مدى العام الماضي بعد أن نعمت بفترة من النمو السريع، حيث تكيف الناشرون والمطورون مع انخفاض الطلب في أعقاب انتهاء جائحة كورونا.	9/12/2023
دعوى قضائية تتهم فيسبوك وإنستغرام بتسهيل التحرش بالأطفال	تقدمت ولاية نيو مكسيكو الأميركية بدعوى قضائية تتهم فيها فيسبوك وإنستغرام بأنهما “أرض خصبة” للمتحرشين الذين يستهدفون الأطفال.	8/12/2023
سول: متسللون من كوريا الشمالية يسرقون بيانات عن أسلحة ليزر	قال مسؤول في شرطة مدينة سول الأربعاء إن الشرطة الكورية الجنوبية تحقق فيما إذا كانت مجموعة متسللين إلكترونيين من كوريا الشمالية حصلت على معلومات عن تكنولوجيا دفاعية من بينها ليزر مضاد للطائرات.	7/12/2023
سيناتور أميركي يتهم الحكومات بالتجسس على مستخدمي آبل وغوغل	حذر السيناتور الأميركي رون وايدن في رسالة إلى المدعي العام ميريك غارلاند من أن الحكومات الأجنبية تتجسس على مستخدمي الهواتف الذكية عن طريق إجبار شركتي آبل وغوغل على تسليم سجلات إشعارات الدفع.	7/12/2023
شاهد قدرات الذكاء الاصطناعي "جيميني" من غوغل	أطلقت غوغل أمس الأربعاء برنامج “جيميني” والذي تعتبره نموذج الذكاء الاصطناعي ذا القدرة الأكبر من بين منتجاتها، وقد أظهر العديد من القدرات في فيديو نشرته غوغل على موقعها على يوتيوب.	7/12/2023
آبل تسد ثغرات أمنية بأجهزتها وتطلب تحديثها	اتخذت شركة آبل إجراءات سريعة استجابة للمخاوف الأمنية الأخيرة التي ظهرت تأثيراتها على أجهزة آيفون وآيباد وماك، فقد أطلقت شركة التكنولوجيا تحديثات أمنية مهمة.	6/12/2023
7 تدابير مهمة للتصدي لهجمات القرصنة الإلكترونية	تعتبر الهجمات الإلكترونية آفة هذا العصر الذي يجب الحذر منها في زمن أصبحت التكنولوجيا ضرورة في حياتنا المعاصرة، وفيما يلي نستعرض 7 تدابير يمكنك اتخاذها لإنقاذك من القراصنة.	6/12/2023
أخيرا.. يمكنك مشاركة الصور والفيديوهات بجودتها على واتساب	يطرح تطبيق “واتساب” حاليا تحديثا جديدا لمستخدمي نظام “آي أو إس” يسمح للأشخاص بمشاركة الصور ومقاطع الفيديو عبر منصته بجودتها الأصلية دون أي ضغط.	5/12/2023
بريطانيا: لا دليل على اختراق موقع سيلافيلد النووي	قالت الحكومة البريطانية أمس الاثنين تعقيبا على تقرير لصحيفة غارديان، إنه ليس لديها سجلات أو أدلة تشير إلى أن الشبكات في موقع سيلافيلد النووي كانت ضحية لهجوم إلكتروني ناجح شنته جهات حكومية.	5/12/2023
تقنيات الأمن السيبراني والتحديات المستقبلية	يمثل الأمن السيبراني الدرع الرقمي الذي يحمي عالمنا المتصل بالإنترنت. وفي عصر تكنولوجيا المعلومات حيث تتداخل حياتنا مع الشبكة العنكبوتية، يصبح الأمن السيبراني أمرا حيويا للحفاظ على خصوصيتنا.	4/12/2023
خبير: الذكاء الاصطناعي أقرب لذكاء القطط والكلاب من ذكاء البشر	لا يعتقد رئيس قسم ميتا للذكاء الاصطناعي أن الذكاء الاصطناعي الفائق سيصل قريبا، ويرى أن الحصول على ذكاء “القطط و الكلاب” ربما يكون أقرب من الحصول على ذكاء البشر.	4/12/2023
"إيرباص" تكشف عن "تاكسي طائر" كهربائي يعمل داخل المدن	كشفت شركة صناعة الطائرات الأوروبية إيرباص عن مشروع لتطوير طائرة عمودية كهربائية صغيرة تعمل كـ”تاكسي طائر” داخل المدن.	4/12/2023
سايبرترك.. شاحنة جديدة أعلن عنها ماسك وقدمها بسعر باهظ	سلم إيلون ماسك شاحنة سايبرترك الجديدة الأسبوع الماضي، وظهرت مواصفات الشاحنة الجديدة، وكان لدى بعضهم ملاحظات مهمة على مواصفاتها وأسعارها.	4/12/2023
غوغل تحذف تطبيقا لمقاطعة الشركات المؤيدة لإسرائيل	قامت غوغل بحذف تطبيق للهاتف المحمول من متجر تطبيقات غوغل بلاي (Google Play) يخبر المستخدمين بالشركات المويدة لإسرائيل والتي يجب مقاطعتها بسبب الحرب في غزة.	3/12/2023
الاتحاد الأوروبي وغوغل يتّحدان لمجابهة خطر الهجمات السيبرانية	وافق البرلمان الأوروبي على قواعد جديدة تُلزم الشركات المصنعة للمنتجات التقنية الذكية بتوفير حماية أفضل لهذه التقنيات من خطر القرصنة، وقيام شركة غوغل ببناء أكبر مركز للأمن السيبراني لها بأوروبا.	3/12/2023
شاهد إيلون ماسك يشتم "المعلنين المستنكفين"	اعتلى إيلون ماسك المسرح في مؤتمر ديل بوك لإجراء مقابلة، فتحدث عن حياته وشركاته قبل أن ينتقل إلى الموضوع الأكثر إثارة وهو منشورات ماسك الأخيرة على منصة إكس.	30/11/2023
اختتام النسخة الـ11 لمؤتمر القمة العالمي للابتكار في التعليم "وايز"	اختتمت أمس أعمال النسخة الـ 11 لمؤتمر القمة العالمي للابتكار في التعليم “وايز – 2023″، التي عقدت في العاصمة القطرية الدوحة تحت شعار “آفاق الإبداع: تعزيز الإمكانات البشرية في عصر الذكاء الاصطناعي”.	30/11/2023
مشاركون بقمة وايز: "مخرجات مجهولة" للتعليم المدمج بتقنية الذكاء الاصطناعي	حذر مشاركون بمؤتمر القمة العالمي للابتكار في التعليم “وايز” المبادرة العالمية التابعة لمؤسسة قطر، من مستقبل مجهول لمخرجات تعليم يعتمد بشكل رئيسي على تقنيات الذكاء الاصطناعي.	29/11/2023
ميتا تحدث قواعدها للإعلان السياسي واستخدام الذكاء الاصطناعي	كشفت شركة ميتا عن مزيد من التفاصيل بشأن سياساتها الإعلانية المتعلقة بالدورة الانتخابية المقبلة في جميع أنحاء العالم واستخدام الذكاء الاصطناعي في عملية إنشاء الإعلانات.	29/11/2023
الشركة المالكة لتيك توك تستغني عن مئات الوظائف في قسم الألعاب	ألغت شركة التكنولوجيا الصينية العملاقة “بايت دانس” المالكة لتطبيق “تيك توك” مئات الوظائف في وحدة الألعاب التابعة لها.	28/11/2023
هولندا توافق على بيع "نوي إنيرجي" للرقائق إلى شركة صينية	حصلت شركة أشباه الموصلات الصينية “نيكسبريا” على موافقة الحكومة الهولندية على شراء شركة الرقائق الإلكترونية “نوي إنيرجي” بعد مراجعة الصفقة في ضوء اعتبارات الأمن القومي الهولندي.	28/11/2023
أداة تتوقع طقس 10 أيام في 60 ثانية.. تعمل بالذكاء الاصطناعي	كشف باحثو “غوغل ديب ميند” عن نموذج دقيق للتنبؤ بالطقس يعتمد على الذكاء الاصطناعي، يمكنه تحديد الخصائص بدقة مثل ضغط الهواء ودرجة الحرارة والرطوبة والرياح لمدة تصل إلى 10 أيام مقدما وخلال 60 ثانية.	27/11/2023
مايكروسوفت تضيف روبوت دردشة الذكاء الاصطناعي "كوبايلوت" لجميع منتجاتها	أعلنت مايكروسوفت أنها تخطط لإضافة روبوت الدردشة الخاص بالذكاء الاصطناعي كوبايلوت إلى جميع منتجاتها وخدماتها، ويوجد كوبايلوت في ويندوز 11، وأضافته الشركة الآن إلى ويندوز 10.	27/11/2023
هل توجد حياة في الفضاء.. الذكاء الاصطناعي يمكنه أن يُخبرنا الآن	مع تنامي قدرات خوارزميات الذكاء الاصطناعي ومنها أنظمة التعلم الآلي والعميق والشبكات العصبية، التجأ مجتمع علماء الفضاء إليها لعلهم يجدون فيها ضالتهم.	27/11/2023
بوتين يحث الروس على منافسة الذكاء الاصطناعي الغربي	ندد الرئيس الروسي فلاديمير بوتين بالاحتكار الغربي “الخطير” لتكنولوجيا الذكاء الاصطناعي، واعتبر أن روسيا بحاجة إلى استخدام أدواتها الخاصة لمنافسة روبوتات الدردشة الغربية “المتحيزة”.	26/11/2023
سام ألتمان وأزمته مع شركة "أوبن إيه آي" .. القصة من البداية	تعرضت أشهر شركات الذكاء الاصطناعي الناشئة “أوبن إيه آي” لفوضى عارمة الأسبوع الماضي هددت مستقبلها بعد إقالة رئيسها التنفيذي سام ألتمان بشكل مفاجئ، فما خفايا ما وقع وما تداعياته؟	26/11/2023
"سايبر طوفان الأقصى" تخترق أكبر شركة أمن سيبراني بإسرائيل	ذكر تقرير حديث أن شركات أمن المعلومات الإسرائيلية ومنها شركة رادواير، وهي شركة إسرائيلية للأمن السيبراني، كانت آخر ضحايا هجمات مجموعة “سايبر طوفان الأقصى”.	25/11/2023
تدابير مهمة لأمان تطبيقات أندرويد	من المفترض أن يكون متجر تطبيقات غوغل بلاي بمثابة بنك التطبيقات الآمن لنظام تشغيل غوغل أندرويد، وهذا هو الواقع في معظم الأحيان، إلا أن القراصنة قد يتمكنون من وقت إلى آخر من نشر تطبيقات مشبوهة.	23/11/2023
ملثم "سايبر طوفان الأقصى" يعلن اختراق وزارة الدفاع الإسرائيلية	أعلنت مجموعة الهاكرز التي تطلق على نفسها “سايبر طوفان الأقصى” عن مسؤوليتها عن اختراق عددا من المواقع الإلكترونية الإسرائيلية من بينها وزارة الدفاع الإسرائيلية.	22/11/2023
الذكاء الاصطناعي يتنبأ بالموت المفاجئ	ظلت فكرة البحث عن أفضل العلاجات تراود عقول العلماء حتى يومنا هذا، لكن ما أحدثه الذكاء الاصطناعي في تطوير النظام الصحي في السنوات القليلة الماضية لا يُقارن بِما سبقه.	22/11/2023
"ميتا" تحل فريقها للذكاء الاصطناعي	حلت “ميتا” فريقها للذكاء الاصطناعي المسؤول، وهو الفريق المسؤول عن فهم الأضرار المرتبطة بتكنولوجيا الذكاء الاصطناعي التي تطورها ومنعها.	21/11/2023
البيت الأبيض ينضم إلى منصة ثريدز	أطلق البيت الأبيض قبل أقل من عام على انتخابات 2024 حسابات عبر منصة التواصل الاجتماعي ثريدز للرئيس جو بايدن ونائبته كامالا هاريس وموظفي البيت الأبيض.	21/11/2023
غرامات بمليارات الدولارات على شركات التكنولوجيا.. لكنها لا تسدد	لا يكاد يمر شهر دون فرض غرامات باهظة على شركات عملاقة للتكنولوجيا، إما بسبب تحديد الأسعار، أو سحق منافسين، أو سوء استخدام بيانات. ولكن قد يستغرق الأمر سنوات قبل أن تدفع هذه الشركات فلسا واحدا.	20/11/2023
مؤسس "أوبن إيه آي" المُقال سام ألتمان "مرحب به" في فرنسا	تتسابق الدول في استقطاب خبراء الذكاء الاصطناعي، وسام ألتمان مؤسس “أوبن إيه آي” على رأس هذه القائمة الآن بعد إقالته من منصبه مؤخرا.	20/11/2023
غوغل "أندرويد" وآبل "آي أو إس".. وجها لوجه	يهيمن نظاما التشغيل غوغل أندرويد وآبل “آي أو إس” على عالم الأجهزة الجوالة، حيث تعمل جميع الهواتف الذكية والحواسيب اللوحية بهذين النظامين تقريبا، إلا أن نظام غوغل أصبح أكثر انتشارا في الآونة الأخيرة.	19/11/2023
برنامج تجسس على حواسيب لوحية تباع للأطفال	قررت “وول مارت” وقف بيع أحد أنواع الحواسيب اللوحية المخصصة للأطفال عبر متجرها الإلكتروني بعد اكتشاف برنامج تجسس موجود في الجهاز مما يعرض بيانات الأطفال المستخدمين للخطر.	19/11/2023
شركة أوبن إيه آي تطيح بمؤسسها ومطلق ثورة "شات جي بي تي"	أصبح سام ألتمان، مؤسس شركة “أوبن إيه آي” ومطلق منصة الذكاء الاصطناعي التوليدي “شات جي بي تي”، خلال عام واحد شخصية رئيسية في سيليكون فالي، إلى أن أقيل الجمعة من مهامه في رئاسة الشركة.	18/11/2023
