title	text	publication_date
بريطانيا تحظر "تيك توك" على الأجهزة الحكومية	قال وزير الدولة البريطاني أوليفر دودن إن إن الحكومة حظرت استخدام تطبيق “تيك توك” (TikTok) على الهواتف والأجهزة الحكومية، وتحدث عن مخاطر بشأن كيفية استخدام البيانات الحساسة على منصات معينة.	16/3/2023
بعد خداعه العملاء.. أول محام روبوت في العالم يتعرض للمقاضاة	تستعد الشركة الناشئة “دو نوت باي” التي طوّرت أول محامٍ روبوت في العالم لواحدة من أولى معاركها القضائية الكبيرة، حيث تواجه دعوى جماعية بسبب مزاعم بأنها ضللت العملاء.	15/3/2023
معرض "إم دبليو سي" للتقنيات النقالة 2023.. هواتف جديدة وكبسولة نقل صديقة للبيئة	واصل برنامج “حياة ذكية” تغطية فعاليات معرض ” إم دبليو سي” (MWC) للتقنيات النقالة 2023 من مدينة برشلونة الإسبانية، إذ عرض أبرز الاكتشافات التي توصلت إليها الشركات الكبرى، خاصة في مجال الهواتف الذكية.	15/3/2023
بالفيديو.. غوغل تكشف النقاب عن "عصا سحرية" لصياغة المستندات مع اشتعال سباق الذكاء الاصطناعي	كشفت غوغل عن مجموعة من أدوات الذكاء الاصطناعي المستخدمة في البريد الإلكتروني وأدوات التعاون المشترك والبرمجيات السحابية، مستهدفة بوضوح منافستها مايكروسوفت بعد اشتعال حرب الذكاء الاصطناعي.	15/3/2023
"شات جي بي تي-4".. أهم الميزات في تجربة عملية للجزيرة نت	أطلقت شركة “أوبن إيه آي” الناشئة نموذج الذكاء الاصطناعي القوي الذي يعرف باسم “شات جي بي تي-4” وهو نسخة مطورة عن “شات جي بي تي-3″، فما أبرز مواصفاته وهل تحسّن في مجال اللغة العربية؟	15/3/2023
وقف المكالمات المزعجة.. ميزة جديدة من واتساب انتظرها المستخدمون كثيرا	تعتبر المكالمات من أشخاص مجهولين غير مرحب بهم، من خلال واتساب، من أكثر المشكلات التي ينتظر المستخدمون حلها في هذا التطبيق الشهير.	14/3/2023
باستخدام شات جي بي تي.. هل يسحب تطبيق "كو" الهندي البساط من تويتر؟	استعان تطبيق “كو” الهندي بتقنية الذكاء الاصطناعي “شات جي بي تي”، للتغلب على هيمنة تويتر في السوق الهندي، خصوصا بعد تولي إيلون ماسك إدارة الطائر الأزرق.	14/3/2023
"ريزر إيدج".. هل تستطيع كسر هيمنة "نينتيندو" على أجهزة الألعاب المحمولة؟	تحولت الألعاب المحمولة إلى نشاط تجاري كبير، وأصبحت أكثر أهمية بفضل العتاد القوي للأجهزة وارتفاع شعبية البث السحابي، ويبحث اللاعبون عن أجهزة الألعاب المحمولة باهتمام متزايد.	13/3/2023
خبراء يناقشون في مؤتمر الجزيرة قضايا الذكاء الاصطناعي في الإعلام	انطلقت اليوم جلسات مؤتمر الجزيرة الأول للذكاء الاصطناعي في الإعلام، والذي يعقده معهد الجزيرة للإعلام بمشاركة نخبة من المتخصصين في الذكاء الاصطناعي والعاملين في مجال الإعلام.	13/3/2023
شاهد- حذاء يوظف الذكاء الاصطناعي يتيح لك المشي بشكل أسرع دون جهد إضافي	نشر كايسي نايستات، وهو صانع محتوى ومؤسس مشارك لشركة التواصل الاجتماعي “بيمي”، على حسابه في يوتيوب تجربته أحذية “مون واكرز” التي تعمل بالذكاء الاصطناعي وتجعل المشي أسرع.	12/3/2023
ما سر ضعف المحتوى العربي في برامج الذكاء الاصطناعي؟ "شات جي بي تي" يجيب	تزداد أهمية تنمية المحتوى العربي على الويب مع التقدم المثير الذي يحرزه الذكاء الاصطناعي التوليدي بإنشاء الصور والأصوات والنصوص وأخيرا الفيديو، لأن هذا يؤدي لرفع مستوى الذكاء الاصطناعي باللغة العربية.	12/3/2023
بطارية "4680" الجديدة.. وصفة "تسلا" السرية لإنتاج 20 مليون سيارة سنويا	أعلن إيلون ماسك قبل 3 سنوات وبالتحديد في يوم سماه “يوم البطارية” عن عزم تسلا إنتاج بطارية ثورية تسمى “4680” والتي كان يعتمد عليها لإطلاق شاحنة سايبرترك والعديد من المنتجات التي ستعتمد عليها الشركة.	11/3/2023
خطوة لظهور أطباء ومحامين اصطناعيين.. "أوبن إيه آي" تمنح المستخدمين مزيدا من التحكم في نظام الذكاء الاصطناعي التوليدي	أعلن سام ألتمان الرئيس التنفيذي لشركة “أوبن إيه آي” أن الشركة ستطلق أدوات لمنح المستخدمين مزيدا من التحكم في نظام الذكاء الاصطناعي التوليدي.	11/3/2023
مؤتمر الجزيرة للذكاء الاصطناعي والإعلام ينطلق الاثنين	تنطلق بعد غد الاثنين 13 مارس/آذار في العاصمة القطرية الدوحة فعاليات مؤتمر الجزيرة الأول لتقنية الذكاء الاصطناعي في مجال الإعلام.	11/3/2023
عودة إنستغرام تدريجيا بعد تعطل عن العمل دام ساعات	أفاد موقع “داون ديتكتور” بأن موقع إنستغرام تعطل لدى آلاف المستخدمين في جميع أنحاء العالم أمس الخميس، وقد عاد تدريجيا للعمل مع استمرار ورود حالات انقطاع متفرقة.	10/3/2023
لا قيود على حمل السوائل مع الذكاء الاصطناعي.. شاهد- تقنيات التفتيش المتطورة في مطار هلسنكي	يعاني معظم المسافرين إجراءات التفتيش المرهقة التي تعتمد على تقنيات الماسحات القديمة. أما مع تطبيق تقنيات الذكاء الاصطناعي، فأصبحت عملية التفتيش أسهل الآن، وهو ما أثبتته تجربة مطار هلسنكي في فنلندا.	9/3/2023
خدمة جديدة من “واتساب” تتيح مغادرة المجموعات “بصمت”	كيف يمكن أن تخرج من مجموعة واتساب دون أن ينتبه الجميع أنك خرجت؟ هذا السؤال الذي يمكن الآن معرفة الإجابة عنه بهذا الفيديو الذي يظهر الميزة الجديدة في واتساب.	8/3/2023
جديد أوبو وسامسونغ وهواوي في معرض "إم دبليو سي" للتقنيات النقالة	خصصت حلقة (2023/3/8) من برنامج “حياة ذكية” موضوعها للحديث عن معرض “إم دبليو سي” للتقنيات النقالة 2023 المنعقد في مدينة برشلونة، وقدمت تغطية خاصة لجديد التقنيات في مجال الأجهزة الذكية وشبكات الاتصال.	8/3/2023
لمنافسة يوتيوب.. تيك توك يتيح لمستخدميه إنتاج مقاطع مصورة تصل إلى 20 دقيقة	يبدو أن تطبيق “تيك توك” الصيني الشهير قرر تحدي عملاق المقاطع المصورة المعروف “يوتيوب”، وذلك بالإعلان عن إطلاق خدمته الجديدة “سيريز” (Series) لإنتاج مقاطع فيديو طويلة قد تصل إلى 20 دقيقة.	8/3/2023
من تويتر إلى ماستدون.. ميزات ومضار وسائل التواصل الاجتماعي	توفر وسائل التواصل الاجتماعي فرصة لربط المستخدمين معا، ومع اختلاف استخدامات كل منصة فإن إيجابيات وسلبيات المنصات على المستخدم تتقاطع في الكثير من الأحيان.	7/3/2023
وصف وضعها الحالي بـ"مدن الأشباح".. رئيس غوغل يدافع عن سياسة المكاتب الجديدة	دافع الرئيس التنفيذي لشركة غوغل عن سياسة “مشاركة المكتب”، حيث قال إن بعض المكاتب تشبه “مدينة الأشباح” بعد انتقادات عديدة من الموظفين لهذه السياسة.	7/3/2023
متاعب جديدة لتويتر بسبب "خلل غير مقصود" وانخفاض الأرباح	تعاني شركة تويتر منذ استلام إيلون ماسك على عدة أصعدة، فقد أصاب عطل اليوم المنصة ومنع المستخدمين من فتح روابط معينة، في الوقت الذي تشهد فيه الشركة خسائر قد تؤدي لإفلاسها.	6/3/2023
واتساب ترضخ للاتحاد الأوروبي وتعد بالشفافية بعد قانون 2021 المثير للجدل	بعد عامين من الإعلان عن سياسة الخصوصية المثيرة للجدل لواتساب والتي أدت لهجرة جماعية من التطبيق باتجاه المنافسين، وعدت المنصة بالانفتاح والشفافية بخصوص سياسات الخصوصية مع المستخدمين.	6/3/2023
مواصفات جوال "أوبو فايند إن2 فلب" وأسعاره في الدول العربية	هاتف “أوبو فايند إن2 فلب” القابل للطي يعد المنافس الأكبر لهاتف “سامسونغ غالاكسي زد فلب”، لامتلاكه العديد من الميزات والمواصفات التي نجمعها لك مع الأسعار التقريبية في الوطن العربي.	6/3/2023
معهد الجزيرة للإعلام يعقد مؤتمره الأول للذكاء الاصطناعي	ينظم معهد الجزيرة للإعلام مؤتمرا حول الذكاء الاصطناعي في الإعلام بالعاصمة القطرية الدوحة، يهدف لجمع الخبراء في مجالي التكنولوجيا والإعلام لبحث أفضل استخدامات الذكاء الاصطناعي في مجال الإعلام.	6/3/2023
أسبوع "الإنسآلة".. 3 أحداث تظهر أن الروبوتات قادمة في 2023	ظهرت خلال الأسبوع الماضي عدة أخبار عن الروبوتات في عدة مناسبات، ونستعرض في هذا المقال أبرز هذه الأخبار التي تُظهر أن دخول الروبوتات في حياتنا بشكل أكبر بات قريبا.	5/3/2023
شاهد- تقنية جديدة تشحن هاتفك خلال 5 دقائق فقط	تحاول شركات الهواتف الوصول لصناعة الشاحن السريع الذي يمكّن المستخدم من شحن هاتفه بأقصى سرعة، ونجحت شركة “ريدمي” الصينية في تحقيق سبق في هذا المجال.	4/3/2023
"ميتا" تعلن عن تخفيضات كبيرة في أسعار نظارات الواقع الافتراضي	أعلنت شركة ميتا مالكة منصة فيسبوك أمس الجمعة أنها ستخفض أسعار نظارات الرأس “كويست 2” وسماعات “كويست برو” المتطورة.	4/3/2023
علامات تدل على أن حسابك محظور على إنستغرام	يواجه مستخدمو تطبيق إنستغرام بعض المشاكل مثل عدم تمكنهم من الوصول إلى صفحات الأشخاص الذين يهمهم متابعتهم، وعدم تلقي إعجابات أو تعليقات على مشاركاتهم. وقد يكون السبب وراء ذلك هو حظرهم من قبل هؤلاء.	3/3/2023
أخطاء جديدة تسمح للقراصنة بكشف صورك على "آيفون" وهكذا تحمي معلوماتك الشخصية	حدد خبراء الخصوصية خطأين آخرين في نظام تشغيل آبل (Apple) بعد أقل من 10 أيام من كشف عملاق التكنولوجيا عن أخطاء أخرى يعاني منها “iOS 16”.	3/3/2023
الرقائق الإلكترونية نفط المستقبل.. ما مكوناتها؟ وكيف تعمل؟	تسبّب نقص الرقائق في إحداث دمار في العديد من الصناعات، لذلك تبذل الولايات المتحدة جهودا واضحة للاستثمار في صناعة أشباه الموصلات التي يعدّها البعض “النفط الجديد”.	2/3/2023
إيلون ماسك: أنا قلق ومتوتر من هذا الذكاء الاصطناعي	قال إيلون ماسك رئيس شركتي “تسلا” و”تويتر” إن مجال الذكاء الاصطناعي يوتره وإن على الحكومة أن تنظمه وتضبطه. ورأى أن هذه التقنية “خطيرة للغاية”. وتابع “أخشى أن أكون قد فعلت بعض الأشياء لتسريعها”.	2/3/2023
7 أجهزة ذكية متوفرة للطالب اليوم.. هل تخدمه أم تعيق دراسته؟	عالم الدراسة ليس بمعزل عن التكنولوجيا، كما أن الدراسة لم تعد تعني بأي حال من الأحوال الكتب والمراجع فقط، بل تقنيات تساعد الطالب على التحصيل والاستمتاع برحلته الدراسية.	2/3/2023
مبتكر الجوال: الهاتف سيدمج تحت جلد الإنسان في المستقبل	ستصبح الهواتف يومًا ما أجهزة مدمجة في أجسامنا، بدلاً من الألواح المستطيلة السوداء التي تعودنا عليها، وذلك وفقًا لمخترع الهاتف الخلوي مارتي كوبر.	1/3/2023
ماذا لو نفدت بطارية سيارتك؟.. تعرف على شاحن متنقل وسريع ينقذك من الورطة	ماذا لو كنت تمتلك سيارة كهربائية وكنت بحاجة إلى شحن بطاريتها بأسرع وقت ممكن؟ تخيل أن تحصل على شاحن كهربائي ذكي ومتنقل يفي بالغرض. ويمكنك حجزه بشكل مسبق عبر الهاتف ليقوم بشحن بطارية سيارتك.	1/3/2023
منها تاكسي طائر وربوت يكافح الوحدة.. 4 من أبرز الابتكارات في معرض برشلونة للأجهزة المحمولة	يحفل معرض برشلونة للأجهزة المحمولة بعدد كبير من الأدوات الجديدة والابتكارات المتقدمة في عالم التكنولوجيا والاتصالات، من الاستنساخ الأبدي إلى الهيكل العظمي الخارجي المتصل.	1/3/2023
بعد أن أسس "أوبن إيه آي".. إيلون ماسك يحشد فريقا لتطوير منافس لـ"شات جي بي تي"	قالت تقارير إن إيلون ماسك تواصل مع باحثين في الذكاء الاصطناعي خلال الأسابيع الأخيرة بهدف تأسيس مختبر أبحاث جديد لتطوير بديل لروبوت المحادثة “شات جي بي تي”.	28/2/2023
الموظفة النائمة بمقر تويتر عقب فصلها: العمل الشاق كان خطأ	شهدت شركة تويتر جولة جديدة من تخفيض الوظائف وتسريح العشرات من العاملين، بينهم إستر كروفورد مديرة إدارة المنتجات التي انتشرت صورتها العام الماضي وهي نائمة على أرضية المكتب.	28/2/2023
بعد شكاوى المستخدمين.. يوتيوب يصلح عطلا في تطبيقه	أعلن موقع يوتيوب التابع لشركة ألفابت إصلاح عطل يتعلق بتطبيقه الرئيسي، وذلك بعد أن أبلغ آلاف المستخدمين عن مشاكل في الوصول إلى موقع بث مقاطع الفيديو أمس الاثنين.	28/2/2023
بذريعة حماية البيانات.. كندا تحظر تطبيق تيك توك وأميركا تمهل الهيئات شهرا لحظره على أجهزتها الحكومية	حظرت الحكومة الكندية تطبيق تيك توك على كل هواتفها وأجهزتها، مشيرة إلى مخاوف من انتهاك الخصوصية والأمن، كما أمهل البيت الأبيض الهيئات الحكومية شهرا للتأكد من عدم وجود التطبيق على الأجهزة الحكومية.	28/2/2023
ميزة جديدة على "فيسبوك ماسنجر" يجب تفعيلها لتجنب "المتطفلين"	من أجل ضمان تجربة استخدام ممتعة، تقوم شركة “ميتا” بتزويد تطبيق التراسل “ماسنجر”، من حين إلى آخر، بمجموعة من التحديثات التي تضمن المزيد من الخصوصية.	27/2/2023
ما تطبيق "بي ريل" الذي يغزو أوساط الشباب والمراهقين؟	يحظى تطبيق التواصل الاجتماعي “بي ريل” بشعبية كبيرة في أوساط الشباب والمراهقين، وتعتمد فكرته على ظهور إشعار على الهاتف الذكي بشكل غير متوقع مرة واحدة يوميا يطلب من المستخدم نشر حالته.	27/2/2023
بعد 60 عامًا.. "نوكيا" تغير شعارها فهل تغير إستراتيجيتها؟	أعلنت نوكيا، اليوم الأحد، عن خطط  لتغيير هوية علامتها التجارية لأول مرة منذ ما يقرب من 60 عامًا كاملة بشعار جديد، حيث تركز الشركة المصنعة لمعدات الاتصالات على النمو القوي.	26/2/2023
كيف تصل للقائمة المخفية في "فيسبوك" التي تظهر لك من تجاهلك؟	يحتوي “فيسبوك” على صفحة غير معروفة تكشف إذا تعرضت لتجاهل طلبك للصداقة من قبل البعض عبر التطبيق، وتتضمن هذه القائمة جميع الأشخاص الذين أرسلت إليهم طلبات صداقة ولم يقبلوا طلبك.	26/2/2023
شاهد- هاتف "بلاكفيو" الجديد للاستخدامات الشاقة	كشفت شركة بلاكفيو الصينية المتخصصة في صناعة الهواتف التي تعمل تحت ظروف قاسية عن أحدث هواتفها طراز “بي في 9200″، والذي يتميز بتصميمه المتين ومواصفاته القوية.	25/2/2023
نموذج لغة جديد من شركة "ميتا" يشعل سباق الذكاء الاصطناعي	قالت شركة “ميتا” (Meta) أمس الجمعة إنها ستطلق للباحثين نموذجا جديدا للغة الكبيرة، يعد الأساس لأنظمة الذكاء الاصطناعي، حسب تقرير نشرته وكالة رويترز (Reuters).	25/2/2023
تقرير يكشف مواقع التواصل الاجتماعي التي تتجسس عليك أكثر من غيرها	تتتبع مواقع وسائل التواصل الاجتماعي كل تحركاتك، وتجمع كميات هائلة من البيانات الشخصية عن ملايين المستخدمين غير الراغبين بذلك، لكن بعضها يجمع معلومات أكثر من غيره.	24/2/2023
التطور الأهم في عهد ماسك.. ترحيب بإضافة تويتر ميزة أخرى للتحقق من المعلومات ومنع التضليل	أعلنت منصة تويتر -الأربعاء- عن إضافة جديدة لنظام التحقق من الأخبار الخاص بها، حيث سترسل المنصة إشعارًا لأي شخص رد على تغريدة أو أعجب بها، في حال إضافة “ملاحظة المجتمع” إليها.	24/2/2023
لمنافسة تسلا.. مرسيدس تستعين بغوغل لمنح سياراتها "أداء الحواسيب الخارقة"	أعلنت شركة “مرسيدس بنز” أنها تعاونت مع “غوغل” في مجال الملاحة وستقدم في كل سيارة مزودة بأجهزة استشعار للقيادة الآلية “أداء فائقا يشبه أداء الحواسيب الخارقة”	23/2/2023
نصائح مفيدة للتعامل اليومي مع البريد الإلكتروني	لا يزال البريد الإلكتروني إحدى الوظائف المهمة للإنترنت، بعد أكثر من 50 عاما من أول رسالة إلكترونية. وفيما يلي بعض النصائح المفيدة لتحسين التعامل اليومي مع البريد الإلكتروني وتعزيز جوانب الأمان.	23/2/2023
تجنبا لإنفاق الأطفال دون معرفتك.. هكذا تعطل خيار "الشراء داخل التطبيق"	يوصي خبراء الأمن المعلوماتي الوالدين بتعطيل خيار عمليات الشراء داخل تطبيقات الألعاب (In-App Purchases)، تجنبا لوقوع الأطفال في فخ إنفاق الأموال دون معرفة ذويهم.	22/2/2023
هل تريد الكسب من فيديوهات “تيك توك”؟.. “برنامج الإبداع” أداة جديدة لتحقيق الأرباح عبر المنصة	أعلنت منصة “تيك توك” (TikTok) عن إطلاق نسخة تجريبية من “برنامج الإبداع” وهو صندوق مبتكر من أجل توليد إيرادات أعلى وفرص أكبر للمبدعين عبر المنصة.	22/2/2023
شاهد.. روبوت "شات جي بي تي" يحاور بيل غيتس وريشي سوناك	أجرى روبوت المحادثة “شات جي بي تي” محادثة مع مؤسس مايكروسوفت بيل غيتس ورئيس الوزراء البريطاني ريشي سوناك، وهو ما اعتبره مراقبون علامة فارقة مهمة في تطوير تقنية الذكاء الاصطناعي.	21/2/2023
هاكر تركي يخترق موقع صحيفة شارلي إيبدو ردا على سخريتها من الزلزال	اخترق هاكر تركي موقع صحيفة شارلي إيبدو الفرنسية على الإنترنت لبضع ساعات ردا على الكاريكاتير الذي نشرته الصحيفة ويحمل سخرية من الزلزال الذي ضرب جنوبي تركيا وشمالي سوريا مؤخرا.	21/2/2023
تحقيق للجزيرة نت يكشف توليد "شات جي بي تي" روابط مزيفة ونسبها لموقع الجزيرة	أجرت الجزيرة نت تحقيقا أظهر أن برنامج المحادثة “شات جي بي تي” القائم على الذكاء الاصطناعي قادر على توليد روابط مزيفة خاصة بالجزيرة والادعاء بأنها مصادر حقيقية لمعلوماته.	21/2/2023
مهندسون أتراك يطورون تقنيات لمساعدة ضحايا الزلزال	عمل المهندسون الأتراك منذ اليوم الأول للزلازل التي ضربت البلاد على تطوير العديد من التطبيقات والمنصات التقنية للرد على صرخات ضحايا الزلازل طلبا للمساعدة، نستعرض في هذا التقرير أبرزها.	21/2/2023
"مقامرة تعتمد التخمين".. مخترع شبكة الويب يهاجم العملات المشفرة ويبشر بمستقبل الإنترنت الجديد	وصف تيم بيرنرز-لي، عالم الحاسوب البريطاني ومخترع شبكة الويب، العملات المشفرة بأنها “خطيرة” وأنها “مقامرة”، وجاءت تصريحاته في أثناء استضافته في حلقة البودكاست “بياند ذا فالي” على قناة “سي إن بي سي”.	20/2/2023
زوكربيرغ يفرض اشتراكا شهريا على الراغبين بالعلامة الزرقاء في فيسبوك وإنستغرام	أعلن الرئيس التنفيذي لشركة “ميتا” مارك زوكربيرغ عن إقرار قواعد جديدة لتوثيق الحسابات مقابل اشتراك مدفوع شهريًّا، في خطوة هي الأولى في تاريخ المنصة.	19/2/2023
اعتبرها البعض "ابتزازا للمستخدمين".. تويتر تحصر إحدى خدمات التحقق على مشتركي "بلو"	قرار منصة تويتر بحصر ميزة التحقق بخطوتين عبر الرسائل النصية على مشتركي خدمة “تويتر بلو” أثار انقساما واسعا بين المستخدمين، إذ دعم بعضهم القرار، في حين انتقد كثيرون ما فعلته الشركة.	19/2/2023
