title	text	publication_date
بالتزامن مع إطلاقها اليوم.. مراجعة لعبة "هيل بليد" الجزء الثاني	تأتي المراجعة الأولى للعبة “هيل بليد” سينوا ساكرفيس الجزء الثاني بالتزامن مع إطلاقها اليوم  الثلاثاء من قبل “إكس بوكس” وقد حصلت الجزيرة نت على فرصة مراجعة اللعبة قبل إتاحتها رسميا للجمهور.	21/5/2024
كيف يمكن أن تخسر أموالك بمجرد مسح رمز استجابة سريع؟	أكواد الاستجابة السريعة والمعروفة باسم “كيو آر” قطعت شوطا طويلا منذ اختراعها في عام 1994 بواسطة إحدى الشركات التابعة لشركة تويوتا.	20/5/2024
هل يغير الفيديو التوليدي باستخدام الذكاء الاصطناعي صناعة الأفلام؟	بدأ إدخال تقنيات المعالجة الرقمية ضمن الأفلام عام 1973 مع فيلم وست وورلد، الذي يعتبر أول فيلم روائي طويل استخدم الصور المولدة بالحاسوب، ولكن ما مستقبل السينما في وجود الذكاء الاصطناعي؟	20/5/2024
آبل وغوغل تمنعان إساءة استعمال أجهزة التتبع الصغيرة	أعلنت شركة آبل عن تطوير معيار مشترك بالتعاون مع شركة غوغل لمنع إساءة استعمال أجهزة التتبع الصغيرة، التي تعمل بتقنية البلوتوث، حتى لا يتم تتبع الأشخاص بشكل غير مرغوب فيه.	20/5/2024
شاشات لمس إلكترونية مضادة للميكروبات.. حلول واعدة	فى دراسة حديثة نشرت في مجلة “نيتشر”، صمم فريق من الباحثين سطحا نحاسيا شفافا ذا بنية نانوية مضادة لبعض الميكروبات، وهو غير موصل كهربائيا.	20/5/2024
4 تطبيقات مجانية لإنشاء المحتوى بالذكاء الاصطناعي على الآيفون	تشعر الآن كما لو أن كل مجال التقنية يدور حول الذكاء الاصطناعي، حيث يمكنك بسهولة إنشاء مختلف أنواع المحتوى، والمميز أنك لا تحتاج إلى جهاز حاسوب بإمكانيات قوية، بل بمجرد استخدامك هاتف الآيفون.	19/5/2024
دليلك للانتقال إلى ماك بوك.. ما أساسيات نظام ماك أو إس؟	إن كنت حديث العهد بحواسيب آبل، فقد تجد صعوبة في معرفة من أين تبدأ استخدامها والاستفادة من مميزاتها ولكن ببعض الإرشادات والممارسة، ستتمكن من التعامل مع جهاز ماك الخاص بك كمحترف في أسرع وقت.	19/5/2024
ميزة جديدة في أندرويد لاكتشاف لحظة تعرض هاتفك للسرقة	تكشف غوغل عن مجموعة من ميزات الأمان الجديدة مع طرحها الإصدار التجريبي الثاني من أندرويد 15، ومنها ميزة لكشف لحظة سرقة الهاتف من بين يديك.	19/5/2024
"أوبن إيه آي" تحل الفريق الذي يعمل على مخاطر الذكاء الاصطناعي	قررت شركة “أوبن إيه آي” حل الفريق الذي يركز على المخاطر طويلة الأمد للذكاء الاصطناعي بعد عام واحد فقط من إعلانها تشكيل هذا الفريق، وفقًا لما أكده شخص مطلع على الوضع.	18/5/2024
منتدى قطر الاقتصادي يناقش الاستثمار في الميتافيرس والتحولات الرقمية	ركز منتدى قطر الاقتصادي في يوم انعقاده الأخير، مساء الخميس، بالدوحة على ملامح اقتصاد المستقبل في ظل التحولات الرقمية، وآخر التطورات والتحديثات التي شهدتها الميتافيرس على الصعد الاقتصادية كافة.	18/5/2024
المفوضية الأوروبية تهدد مايكروسوفت بعقوبات على خلفية التضليل المرتبط بالذكاء الاصطناعي	هددت المفوضية الأوروبية الجمعة موقع “بينغ” التابع لمجموعة “مايكروسوفت” بعقوبات مالية لعدم استجابته لطلباتها بالحصول على معلومات عن مخاطر المعلومات المضللة المرتبطة بوظائف الذكاء الاصطناعي لمحرك البحث.	18/5/2024
ماسك يعلن الانتقال النهائي رسميا من "تويتر" إلى "إكس دوت كوم"	أعلن الملياردير الأميركي إيلون ماسك، الجمعة، عبر منصة إكس أن “كل الأنظمة الأساسية” لشبكته الاجتماعية المعروفة سابقا باسم تويتر، “باتت فاعلة” تحت اسم النطاق “إكس.كوم”.	17/5/2024
تقنيات جديدة وذكاء اصطناعي يتوسط ساحة الحرب على غزة.. ولكن هل حقق المطلوب؟	استخدمت إسرائيل كل ما لديها من تقنيات في حربها على غزة، تقنيات غير موجودة لدى بعض أكثر الدول تقدما، لكن هل نجحت هذه التقنيات بترجيح كفتها في الحرب؟	17/5/2024
كيف تحمي أعمالك الفنية من الذكاء الاصطناعي	أعرب الفنانون والمبدعون عن قلقهم بشأن الذكاء الاصطناعي التوليدي الذي يكرر ويسرق أعمالهم وأسلوبهم الفني وربما حياتهم المهنية، ولكن هناك أداة يمكنها حماية الأعمال الفنية من التقليد.	16/5/2024
الذكاء الاصطناعي قد يعوق الوصول إلى حضارات ذكية أخرى	دراسة حديثة تعتقد أنّ الذكاء الاصطناعي يحجّم فرص البشر من التواصل مع أيّ حضارة ذكية أخرى في الكون.	16/5/2024
"الجزيرة نت" تحاور مصمما عالميا دخل موسوعة غينيس واستعاد وجه فرعون	تحاور “الجزيرة نت” المصمم العالمي ثلاثي الأبعاد سيسيرو مورايس الذي أجاب على 13 سؤالا عن تفاصيل مهنته وكيف تساعد في كشف أسرار الماضي وتساهم في تخفيف آلام البشر والكائنات الحية؟	16/5/2024
أميركا تبحث مخاوفها من "إساءة استخدام" الصين للذكاء الاصطناعي	أعلنت الولايات المتحدة الأربعاء أنها أثارت مع الصين مخاوفها بشأن “إساءة استخدام” الأخيرة للذكاء الاصطناعي، لكنها أعربت عن أملها في إبقاء قنوات التواصل مفتوحة بين القوتين الكُبريين بشأن هذه التقنية.	16/5/2024
شاشة في خوذة ترفع مستوى الأمان بالدراجة النارية	عند قيادة الدراجات النارية يتابع قائد الدراجة النارية حركة الطريق من حوله باستمرار، ولكنه قد يحتاج إلى إلقاء نظرة على لوحة العداد، وهو ما قد يتسبب في تشتت انتباهه، هنا تظهر أهمية شاشة “هيد أب”.	15/5/2024
إليك أهم الميزات التي تسهل استخدام هاتف آيفون	يُنتقد جهاز آيفون لافتقاره إلى ميزات التخصيص العميقة لنظام أندرويد، ولكن أحد الجوانب التي يتألق فيها هو ميزاته الخفية التي غالبًا ما تسهل استخدامه.	15/5/2024
إيليا سوتسكيفر كبير العلماء في "أوبن إيه آي" يعلن تركه مجلس إدارة الشركة	أعلن المشارك في تأسيس “أوبن إيه آي” إيليا سوتسكيفر الثلاثاء تركه مجلس إدارة الشركة التي باتت من أبرز المجموعات التكنولوجية في “سيليكون فالي” بفضل برنامجها “تشات جي بي تي”.	15/5/2024
عصر جيميناي.. أهم ما أعلنت عنه غوغل في مؤتمر المطورين "آي/ أو" 2024	استمرارًا لصراع الذكاء الاصطناعي الحالي، ركزت غوغل في مؤتمرها  للمطورين “آي/ أو” لعام 2024 على أحدث مميزات نموذجها للذكاء الاصطناعي التوليدي “جيميناي”.	15/5/2024
تقرير أممي يحذر من تفاقم مشكلة النفايات الإلكترونية	كشف تقرير للأمم المتحدة عن أن توليد النفايات الإلكترونية في العالم يتزايد بمعدل 5 مرات أسرع من إعادة تدوير النفايات الإلكترونية الموثقة.	14/5/2024
أوبن إيه آي تشعل المنافسة بإطلاقها "جي بي تي-4 أو"	طرحت “أوبن إيه آي” نموذجا جديدا للذكاء الاصطناعي، من روبوت المحادثة الشهير “شات جي بي تي”، إلى جانب تحديث واجهة المستخدم، لتشعل المنافسة المحتدمة في سوق روبوتات الذكاء الاصطناعي.	14/5/2024
380 مليار دولار لتطوير أشباه الموصلات والمنافسة على أشدها بين الكبار	خصصت الولايات المتحدة وحلفاؤها نحو 81 مليار دولار لتطوير الجيل القادم من أشباه الموصلات، في حين يمثل التدفق الهائل من الأموال نحو هذا القطاع منعطفا حاسما في المواجهة التكنولوجية المستمرة مع الصين.	14/5/2024
الجزيرة نت تحاور "إكس بوكس" وأستوديو "ميزان" القطري حول مستقبل ألعاب المنطقة	جذب الحراك الذي تشهده المنطقة، في مجال صناعة الألعاب، انتباه شركة “إكس بوكس” التابعة لمايكروسوفت، والتي تبنت لعبة عربية حديثة من تطوير أستوديو ألعاب قطري.	13/5/2024
مهرجان للسينما بالذكاء الاصطناعي.. هل تتأثر هوليود بالتطور التقني قريبا؟	يفتح مهرجان نيويورك لأفلام الذكاء الاصطناعي الباب على الإمكانات المتاحة من خلال هذه التكنولوجيا التي أصبحت في متناول الجميع، عبر أفلام قصيرة تعكس خيال مبتكريها مع مشاهد ذات طابع جمالي خارق.	13/5/2024
انتبه لهذه الأشياء قبل شراء السماعة اللاسلكية من "سينهايزر"	تحتدم المنافسة في سوق السماعات اللاسلكية بشدة، وتسعى بعض الشركات إلى التفوق على منافسيها بطرح طرازات منخفضة التكلفة.	13/5/2024
ميزة "دائرة البحث" الجديدة من غوغل تنتقل لآيفون	نجحت شركة التكنولوجيا وخدمات الإنترنت العملاقة (غوغل) في إيجاد طريقة لتوفير خاصية البحث الذكية الجديدة المعروفة باسم “دائرة البحث” أو “سيركل تو سيرش” لمستخدمي هواتف آيفون الذكية.	12/5/2024
في سابقة تاريخية للشركة موظفو أحد متاجر "آبل" يصوتون لصالح الإضراب	صوّت موظفو أحد متاجر شركة “آبل” في الولايات المتحدة لصالح إضراب، قد يكون في حال تنفيذه، الأوّل الذي يطال المجموعة الأميركية العملاقة.	12/5/2024
أمثلة على "خداع" الذكاء الاصطناعي البشر… والآتي أعظم!	يخشى البعض من أن ينقلب الذكاء الاصطناعي على الإنسان مستقبلا، لكن هذه المخاوف باتت واقعا منذ الآن، وفقا لدراسة جديدة، إذ إن البرامج التي صمِمت لتكون صادقة، باتت لديها قدرة مثيرة للقلق على خداع البشر.	12/5/2024
أسهل طريقة لاستخدام هاتف الأندرويد ككاميرا للحاسوب الشخصي	بالرغم من إمكانية استخدام الهواتف الذكية فعلا ككاميرا ويب على جهاز حاسوب يعمل بنظام ويندوز، فإنك غالبًا ستجد الأمر مرهقا ومربكا بعض الشيء، ولا يتمتع بثبات جيد وبالكاد يحقق الفائدة المرجوة.	11/5/2024
ماذا يعني وضع الإغلاق في أجهزة آبل ومن يحتاجه؟	صمم وضع الإغلاق من آبل لمنع الهجمات السيبرانية المتطورة والقوية على أجهزة الشركة، إذ يوفر إعدادات أمان فائقة لأجهزة آيفون، وأجهزة آيباد التي تعمل بأنظمة “آي أو إس 16” والإصدارات الأحدث.	11/5/2024
كيف تتحقق من استخدام باقة البيانات في هاتف الآيفون؟	قد تستفيد من الاتصال بالإنترنت عبر تشغيل باقة بيانات الهاتف على الآيفون، لكن يمكن أن يؤثر على الفاتورة أو انتهاء الباقة بسرعة دون علمك. لهذا، قد تحتاج إلى تتبع استخدامك لباقة البيانات.	10/5/2024
الفيديو الإعلاني لجهاز "آي باد برو" اللوحي الجديد يثير سخط الفنانين	أعرب فنانون معروفون عن سخطهم من فكرة الفيديو الإعلاني لجهاز “آي باد برو” الجديد رأوا فيه تمجيدا للذكاء الاصطناعي على حساب البشر، إذ تظهر فيه أشكال من الإبداع البشري تتعرض للسحق.	10/5/2024
لماذا يعد واتساب تطبيق المراسلة الرقمي الأول في العالم؟	شهد تطبيق واتساب صعودا سريعا منذ انطلاقه عام 2009، ولم تظهر عليه أي علامات على التوقف. وهو اليوم ثالث أكبر تطبيقات وسائل التواصل الاجتماعية من حيث عدد المستخدمين العالميين من بعد فيسبوك ويوتيوب.	9/5/2024
إشارات مخادعة.. كيف تؤثر هجمات الخداع على رحلات الطيران المدني؟	في أواخر أغسطس/آب الماضي، بدأ الطيارون ممن يعملون ضمن منطقة الشرق الأوسط في الإبلاغ عن حالات تعرض أنظمة الملاحة على متن طائراتهم لإشارات مزيفة من نظام “جي بي إس” مما يظهرها كأنها بعيدة عن مسارها.	9/5/2024
لمنع الانتحار.. فك شفرة المشاعر الإنسانية بالذكاء الاصطناعي	طور باحثون نموذجا لفك شفرة المشاعر الإنسانية باستخدام أدوات الذكاء الاصطناعي تدعم عمل مستشاري الخطوط الساخنة لمكافحة الانتحار.	9/5/2024
باريس 2024 تستعين بالذكاء الاصطناعي لحماية الرياضيين خلال الأولمبياد	قررت اللجنة الأولمبية الدولية استخدام نظام مراقبة مدعوما بالذكاء الاصطناعي لحماية الرياضيين والمسؤولين من الإساءات عبر شبكة الإنترنت، خلال الأولمبياد ودورة الألعاب الباراليمبية بالعاصمة باريس.	9/5/2024
السيارات الذاتية القيادة.. الخطر الأكبر في طرقات المستقبل؟	رغم أن فكرة السيارات الذاتية القيادة مازالت تبدو مستقبلية بعض الشيء، كوننا لم نصل إلى السيارات إليها بشكل كامل ودون تدخل بشري، فإننا قطعنا أشواطا عديدة في السنوات الماضية.	8/5/2024
تيك توك تقاضي الحكومة الأميركية بدعوى أن الحظر ينتهك الدستور	رفعت شركة تيك توك دعوى قضائية ضد الحكومة الأميركية لوقف تنفيذ مشروع القانون الذي صدر الشهر الماضي بهدف إجبار الشركة الصينية المالكة للتطبيق على بيع حصتها أو حظر التطبيق في الولايات المتحدة.	8/5/2024
أوبن إيه آي تطور أدوات جديدة لاكتشاف المحتوى المولد بالذكاء الاصطناعي	أضافت شركة أوبن إيه آي أداة جديدة لاكتشاف إن كانت الصورة قد صُنعت باستخدام مولدها للصور بالذكاء الاصطناعي “دال-إي”، بالإضافة إلى أساليب جديدة لوضع علامات مائية للإشارة إلى المحتوى الذي يصنعه التطبيق.	8/5/2024
كيف تؤثر التكنولوجيا على حواسنا؟	يؤدي فقدان حاسة الشم إلى مصائب منها الانتحار كما يقول الخبراء، فما تأثير التكنولوجيا عليها وعلى بقية الحواس ومراكز التفكير والإدراك؟	8/5/2024
آيباد أنحف وقلم جديد.. هذا أبرز ما أعلنته آبل في مؤتمرها	انتهى حدث شركة آبل الذي كشفت فيه الشركة الأميركية عن أحدث إصدارات من أجهزتها اللوحية “آيباد”، وعن شريحة معالجتها الجديدة للذكاء الاصطناعي “إم 4”.	7/5/2024
تسريب بيانات جنود الجيش البريطاني في اختراق لوزارة الدفاع	تعرضت وزارة الدفاع البريطانية لاختراق إلكتروني ضخم مما تسبب في تسرب بيانات مهمة، شملت البيانات والمعلومات الشخصية لأفراد الجيش البريطاني، وفقا لصحيفة الغارديان.	7/5/2024
ما رأي آبل وسامسونغ في حيلة الأرز لإنقاذ الهواتف عند سقوطها في الماء؟	يسود اعتقاد بين كثيرين أن الأرز يمثل وسيلة فعالة لإنقاذ الهاتف الذكي بعد سقوطه في الماء. فما مدى صحة هذا الاعتقاد؟ وما رأي مصنعي الهواتف مثل آبل وسامسونغ بهذا؟	7/5/2024
مايكروسوفت تبني نموذج ذكاء اصطناعي لمنافسة غوغل و"أوبن إيه آي"	أفادت صحيفة “إنفورميشن” يوم الاثنين بأن شركة مايكروسوفت تقوم بتدريب نموذج لغة ذكاء اصطناعي داخلي جديد كبير بما يكفي للتنافس مع نماذج شركة ألفابت غوغل، وبرنامج “أوبن إيه آي”.	7/5/2024
باريس 2024 تستعد لمواجهة تهديد غير مسبوق للأمن السيبراني	تستعد دورة باريس 2024 للألعاب الأولمبية لمواجهة تحد غير مسبوق على صعيد الأمن السيبراني، إذ يتوقع المنظمون ضغوطا كبيرة على الألعاب هذا الصيف.	6/5/2024
إنترسبت: مايكروسوفت عرضت أداة ذكاء اصطناعي لدعم أنظمة إدارة القتال بالجيش الأميركي	اقترحت شركة مايكروسوفت استخدام أداة توليد الصور الشهيرة “دال-إي”، التي تطورها شركة “أوبن إيه آي”، لمساعدة وزارة الدفاع الأميركية في تصميم برمجيات لتنفيذ العمليات العسكرية.	6/5/2024
كيف تتحكم في بياناتك التي يمتلكها غوغل؟	شركة غوغل تملك عنك الكثير والكثير من البيانات، تخيل كم البيانات التي تمنحها عبر متصفح كروم وخدمة بريد غيميل وخرائط غوغل ويوتيوب، وكلها خدمات وتطبيقات تدخل في أنشطة حياتنا اليومية المختلفة.	6/5/2024
غوغل تعلن وقف تطبيق بودكاستس اعتبارا من منتصف الشهر المقبل	أبلغت شركة التكنولوجيا وخدمات الإنترنت الأميركية غوغل مستخدمي تطبيق المدونات الصوتية غوغل بودكاستس باعتزامها وقف تشغيل هذا التطبيق بحلول منتصف يونيو/حزيران المقبل.	5/5/2024
خرق أمني أتاح الوصول إلى معلومات حول اجتماعات للجيش الألماني	أفاد موقع “تسايت أونلاين” الألماني السبت بأن خرقا أمنيا معلوماتيا قد أتاح الوصول إلى معلومات تتعلق بانعقاد ما لا يقل عن 6 آلاف اجتماع للجيش الألماني على منصة “ويبيكس” المخصصة للمؤتمرات عبر الفيديو.	5/5/2024
إعدادات كاميرا الآيفون: هل الأفضل الأعلى كفاءة أم الأكثر توافقا؟	كاميرات هواتف آيفون وصلت إلى مستوى واسع في الانتشار والاهتمام، لتصبح كاميرات احترافية يلتقط بها المستخدمون صورهم يوميا. لكن هناك مشكلة لا تحظى بالاهتمام الكافي وهي حجم ملفات تلك الصور.	5/5/2024
الجزيرة نت تستشرف من مكاتب غوغل كلاود مستقبل الذكاء الاصطناعي بالمنطقة العربية	بعد مرور عام على مؤتمر الذكاء الاصطناعي الأول الذي نظمه معهد الجزيرة عام 2023؛ تلتقي الجزيرة نت الدكتورَ شوقي توبي مسؤول الذكاء الاصطناعي في قسم الشركاء.	5/5/2024
ما الذي ننتظره من مؤتمر غوغل للمطورين 2024؟	مؤتمر غوغل “آي/أو”  المؤتمر الأكبر للمطورين الذي تعقده الشركة سنويا، ويشبه إلى حد كبير مؤتمر آبل للمطورين أو مؤتمر مايكروسوفت، وهو الحدث الذي تناقش فيه غوغل كل ما تعمل عليه من أجهزة جديدة وبرمجيات.	4/5/2024
أجهزة آيباد نجم الحفل.. ما الذي نتوقعه من مؤتمر آبل القادم؟	أعلنت آبل عن موعد مؤتمرها الجديد القادم بالسابع من الشهر الجاري، لكنها لم تكشف أي تفاصيل سوى إرسال الدعوات لوسائل الإعلام والتي تضمن تصميمها “قلم آبل” في إشارة لجهاز آيباد.	4/5/2024
"فيكتوريا شي" ناطقة رسمية للشؤون القنصلية في أوكرانيا مولّدة من الذكاء الاصطناعي	أعلنت وزارة الخارجية الأوكرانية الأربعاء أن ناطقة رسمية أُنشئت بواسطة الذكاء الاصطناعي ستتولى من الآن فصاعدا التعليق على الشؤون القنصلية من خلال قراءة نصوص سيكون معدّوها بشرا.	3/5/2024
إسرائيل تطور "قبة سيبرانية" في وجه الهجمات المعلوماتية الإيرانية	في حين يبدو خطر التصعيد العسكري مستبعدا بالوقت الراهن، تدور حرب “صامتة” بين إيران وإسرائيل في الفضاء السيبراني حيث تسعى الأخيرة إلى إحباط الهجمات الإيرانية.	3/5/2024
شركة "أنثروبيك" تطرح روبوت الدردشة "كلود" كتطبيق على الآيفون	أعلنت شركة “أنثروبيك” الناشئة، التي تطور نموذج “كلود” للذكاء الاصطناعي، إطلاق أول تطبيق لروبوت الدردشة الخاص بها على نظام “آي أو إس” لهواتف آيفون.	2/5/2024
ما وراء الخوارزمية والمحتوى.. لماذا تسعى أميركا لحظر تطبيق تيك توك؟	وراء الصراع بين الولايات المتحدة وشركة بايت دانس مالكة تطبيق تيك توك، تكمن تقنية التطبيق الأساسية، وهي الخوارزمية المتطورة التي يعتمد عليها التطبيق لترشيح المحتوى للمستخدمين، فما سر هذه الخوارزمية؟	2/5/2024
موعد عرض ألعاب "إكس بوكس" الصيفي	أعلنت “إكس بوكس” موعد العرض لحدثها الذي يتضمن لأول مرة ألعابا من إنتاج “أكتيفيجن بليزارد” و”بيثيسدا” وأستوديوهات الألعاب التابعة لمايكروسوفت.	2/5/2024
